<!ELEMENT marksheet (course+)>
<!ELEMENT course (courseid,title,CRD,EDORPR,TW,OE,total)>
<!ELEMENT courseid (#CDATA)>
<!ELEMENT title (#CDATA)>
<!ELEMENT CRD (#PCDATA)>
<!ELEMENT EDORPR (#PCDATA)>
<!ELEMENT TW (#PCDATA)>
<!ELEMENT OE (#PCDATA)>
<!ELEMENT total (#PCDATA)>